{
  "$schema": "http://json-schema.org/draft-07/schema#",
  "title": "Almawave Schema Template 2",
  "type": "object",
  "properties": {
    "template": {
      "type": "string",
      "description": "A JSON schema template defining the structure of the data.",
      "enum": ["fc_chat_st", "fc_chat", "chat_st", "chat", "chat_template"],
      "default": "fc_chat_st"
    },
    "system": {
      "type": ["string", "null"],
      "description": "System prompt instructions for the LLM.",
      "default": null
    },
    "context": {
      "type": ["string", "null"],
      "description": "Global conversation context, separate from per-message context.",
      "default": null
    },
    "messages": {
      "type": "array",
      "description": "Conversation turns between USER and ASSISTANT.",
      "items": {
        "type": "object",
        "properties": {
          "role": {
            "type": "string",
            "enum": ["USER", "ASSISTANT"],
            "description": "The role of the message sender."
          },
          "content": {
            "type": ["string", "null"],
            "description": "The textual content of the message, if any."
          },
          "functioncall": {
            "type": ["object", "null"],
            "description": "Optional function call metadata for this message.",
            "default": null,
            "properties": {
              "payload": {
                "type": "string",
                "description": "Serialized function call request."
              },
              "response": {
                "type": "string",
                "description": "Serialized function call response."
              }
            },
            "required": ["payload", "response"]
          },
          "think": {
            "type": ["string", "null"],
            "description": "Optional chain-of-thought or reasoning trace.",
            "default": null
          },
          "context": {
            "type": ["string", "null"],
            "description": "Optional context specific to this message.",
            "default": null
          }
        },
        "required": ["role"]
      },
      "minItems": 1
    },
    "_lang": {
      "type": ["string", "null"],
      "description": "Language of the dataset.",
      "default": null
    },
    "_dataset_name": {
      "type": ["string", "null"],
      "description": "The name of the dataset to be processed.",
      "default": null
    },
    "_filename": {
      "type": ["string", "null"],
      "description": "The file name of the dataset to be processed.",
      "default": null
    },
    "_subpath": {
      "type": ["string", "null"],
      "description": "The subpath of the dataset to be processed.",
      "default": null
    },
    "_id_hash": {
      "type": ["string", "null"],
      "description": "Unique identifier hash of the dataset.",
      "default": null
    }
  },
  "required": ["messages"],
  "additionalProperties": false
}
