{
    "system": null,
    "context": null,
    "template": "fc_chat_st",
    "messages": [
        {
            "role": "USER",
            "content": "Hello, I have a request regarding a past flight reservation, 0U4NPP, from PHL to DEN. I was wondering if I could still cancel it due to personal reasons.",
            "functioncall": null,
            "think": null,
            "context": null
        },
        {
            "role": "ASSISTANT",
            "content": "To assist you with the cancellation request, I need to verify a few details:\n\n1. Your user ID.\n2. The reason for cancellation (change of plan, airline cancelled flight, or other reasons).\n\nPlease provide this information so I can check the eligibility for cancellation.",
            "functioncall": null,
            "think": null,
            "context": null
        },
        {
            "role": "USER",
            "content": "Sure. My user ID is amelia_rossi_1651. The reason for the cancellation request is personal. I understand if it's an unusual request as the flights have already landed, but I thought it was worth checking if there's any flexibility.",
            "functioncall": null,
            "think": null,
            "context": null
        },
        {
            "role": "ASSISTANT",
            "content": null,
            "functioncall": {
                "payload": "{\"name\": \"get_reservation_details\", \"arguments\": {\"reservation_id\": \"0U4NPP\"}}",
                "response": "{\"reservation_id\": \"0U4NPP\", \"user_id\": \"amelia_rossi_1651\", \"origin\": \"PHL\", \"destination\": \"DEN\", \"flight_type\": \"round_trip\", \"cabin\": \"economy\", \"flights\": [{\"origin\": \"PHL\", \"destination\": \"DEN\", \"flight_number\": \"HAT076\", \"date\": \"2024-05-09\", \"price\": 143}, {\"origin\": \"DEN\", \"destination\": \"PHL\", \"flight_number\": \"HAT080\", \"date\": \"2024-05-13\", \"price\": 147}], \"passengers\": [{\"first_name\": \"Amelia\", \"last_name\": \"Rossi\", \"dob\": \"1954-05-19\"}, {\"first_name\": \"Chen\", \"last_name\": \"Johansson\", \"dob\": \"1956-04-23\"}, {\"first_name\": \"Sophia\", \"last_name\": \"Moore\", \"dob\": \"1989-06-12\"}, {\"first_name\": \"Yusuf\", \"last_name\": \"Brown\", \"dob\": \"1986-11-03\"}], \"payment_history\": [{\"payment_id\": \"credit_card_4240750\", \"amount\": 1280}], \"created_at\": \"2024-05-08T22:44:02\", \"total_baggages\": 4, \"nonfree_baggages\": 0, \"insurance\": \"yes\"}"
            },
            "think": null,
            "context": null
        },
        {
            "role": "ASSISTANT",
            "content": "Unfortunately, I cannot process a cancellation for flights that have already been completed, regardless of the reason. If you need further assistance or have any other questions, I can transfer you to a human agent. Please let me know how you would like to proceed.",
            "functioncall": {
                "payload": "{\"name\": \"think\", \"arguments\": {\"thought\": \"The reservation 0U4NPP is for a round trip from PHL to DEN, with flights on May 9 and May 13, 2024. The flights have already been completed, and the user is requesting a cancellation for personal reasons. According to the policy, cancellations cannot be processed for flights that have already been flown, regardless of the reason. Therefore, I need to inform the user that this request cannot be fulfilled and offer to transfer them to a human agent if they need further assistance.\"}}",
                "response": ""
            },
            "think": null,
            "context": null
        },
        {
            "role": "USER",
            "content": "I understand and appreciate your help. No need to transfer me to a human agent. Have a good day!",
            "functioncall": null,
            "think": null,
            "context": null
        },
        {
            "role": "ASSISTANT",
            "content": "You're welcome! If you have any more questions in the future, feel free to reach out. Have a great day!",
            "functioncall": null,
            "think": null,
            "context": null
        }
    ],
    "_lang": "en",
    "_dataset_name": "APIGen-MT-5k",
    "_filename": "apigen-mt_5k",
    "_subpath": "",
    "_id_hash": "d7cc471002545cd8f27c1ca3dc4d35d93c37cddd67767926f0f0dd791ba621b4"
}